{"$id":"urn:randle:r5:reviewer-trust-root","$schema":"https://json-schema.org/draft/2020-12/schema","additionalProperties":false,"properties":{"authorized_review_domain":{"const":"FUTURE_OPERATIONAL_CAPTURE_PACKAGE"},"independence_requirement":{"const":"NO_PACKAGE_AUTHOR_RELATIONSHIP"},"issuer_capability":{"const":"ISSUE_REVIEW_AUTHORITY"},"prohibited_relationships":{"items":false,"maxItems":2,"minItems":2,"prefixItems":[{"const":"SELF_REVIEW"},{"const":"PACKAGE_AUTHOR"}],"type":"array"},"review_interface_version":{"const":"RANDLE-R5-FUTURE-REVIEW-1"},"reviewer_capabilities":{"items":false,"maxItems":1,"minItems":1,"prefixItems":[{"const":"INDEPENDENT_REVIEW"}],"type":"array"},"reviewer_identity":{"const":"independent-r5-reviewer-fixture"},"reviewer_persona":{"const":"INDEPENDENT_GOVERNANCE_REVIEWER"},"reviewer_role":{"const":"BOUNDARY_SPECIFICATION_REVIEWER"},"schema_version":{"const":"7.0.0-DRAFT"},"trust_root_id":{"const":"R5-REVIEWER-TRUST-ROOT"},"trusted_issuer":{"const":"R5-REVIEW-TRUST-ISSUER"},"valid_from":{"const":"2026-07-22T00:00:00Z"},"valid_until":{"const":"2026-07-23T00:00:00Z"}},"required":["schema_version","trust_root_id","reviewer_identity","reviewer_persona","reviewer_role","reviewer_capabilities","independence_requirement","prohibited_relationships","trusted_issuer","issuer_capability","valid_from","valid_until","authorized_review_domain","review_interface_version"],"type":"object"}
