{"authorized_review_domain":"FUTURE_OPERATIONAL_CAPTURE_PACKAGE","independence_requirement":"NO_PACKAGE_AUTHOR_RELATIONSHIP","issuer_capability":"ISSUE_REVIEW_AUTHORITY","prohibited_relationships":["SELF_REVIEW","PACKAGE_AUTHOR"],"review_interface_version":"RANDLE-R5-FUTURE-REVIEW-1","reviewer_capabilities":["INDEPENDENT_REVIEW"],"reviewer_identity":"independent-r5-reviewer-fixture","reviewer_persona":"INDEPENDENT_GOVERNANCE_REVIEWER","reviewer_role":"BOUNDARY_SPECIFICATION_REVIEWER","schema_version":"7.0.0-DRAFT","trust_root_id":"R5-REVIEWER-TRUST-ROOT","trusted_issuer":"R5-REVIEW-TRUST-ISSUER","valid_from":"2026-07-22T00:00:00Z","valid_until":"2026-07-23T00:00:00Z"}
